{
  "schema_version": "workflow.v2",
  "workflow_id": "software_product_development",
  "revision": "wfrev_2026_02_25_a",
  "effective_date": "2026-02-25",
  "name": "Software Product Development",
  "description": "End-to-end workflow for software product creation from discovery through implementation. Uses WP/WS ontology per ADR-051/052. Pipeline restructured per WP-PIPELINE-001.",
  "pow_class": "reference",
  "derived_from": null,
  "source_version": null,
  "tags": [
    "software_delivery"
  ],
  "scopes": {
    "project": {
      "parent": null
    },
    "work_package": {
      "parent": "project"
    },
    "work_statement": {
      "parent": "work_package"
    }
  },
  "document_types": {
    "project_discovery": {
      "name": "Project Discovery",
      "scope": "project",
      "may_own": [],
      "acceptance_required": false
    },
    "implementation_plan": {
      "name": "Implementation Plan",
      "scope": "project",
      "may_own": [],
      "acceptance_required": true,
      "accepted_by": [
        "pm"
      ],
      "description": "Unified plan with candidate Work Packages, risk analysis, and architecture recommendations. Candidates are advisory until promoted to governed WPs."
    },
    "technical_architecture": {
      "name": "Technical Architecture",
      "scope": "project",
      "may_own": [],
      "acceptance_required": true,
      "accepted_by": [
        "architect"
      ]
    },
    "work_package": {
      "name": "Work Package",
      "scope": "project",
      "may_own": [
        "work_statement"
      ],
      "acceptance_required": false,
      "description": "Unit of planned work with scope, governance pins, and completion criteria. Created manually after TA review."
    },
    "work_statement": {
      "name": "Work Statement",
      "scope": "work_package",
      "may_own": [],
      "acceptance_required": true,
      "accepted_by": [
        "pm",
        "technical_lead"
      ],
      "description": "Unit of authorized execution with procedure, verification criteria, and allowed paths"
    }
  },
  "entity_types": {
    "work_package": {
      "name": "Work Package",
      "parent_doc_type": null,
      "creates_scope": "work_package"
    },
    "work_statement": {
      "name": "Work Statement",
      "parent_doc_type": "work_package",
      "creates_scope": "work_statement"
    }
  },
  "steps": [
    {
      "step_id": "discovery",
      "role": "Technical Architect 1.0",
      "task_prompt": "Project Discovery v1.0",
      "produces": "project_discovery",
      "scope": "project",
      "execution_mode": "auto",
      "inputs": []
    },
    {
      "step_id": "implementation_plan",
      "role": "Project Manager 1.0",
      "task_prompt": "Implementation Plan v1.0",
      "produces": "implementation_plan",
      "scope": "project",
      "execution_mode": "auto",
      "inputs": [
        {
          "doc_type": "project_discovery",
          "scope": "project"
        }
      ]
    },
    {
      "step_id": "technical_architecture",
      "role": "Technical Architect 1.0",
      "task_prompt": "Technical Architecture v1.0",
      "produces": "technical_architecture",
      "scope": "project",
      "execution_mode": "auto",
      "inputs": [
        {
          "doc_type": "project_discovery",
          "scope": "project"
        },
        {
          "doc_type": "implementation_plan",
          "scope": "project"
        }
      ]
    },
    {
      "step_id": "work_package_creation",
      "role": "Project Manager 1.0",
      "task_prompt": "Work Package v1.0",
      "produces": "work_package",
      "scope": "project",
      "execution_mode": "manual",
      "inputs": [
        {
          "doc_type": "project_discovery",
          "scope": "project"
        },
        {
          "doc_type": "implementation_plan",
          "scope": "project"
        },
        {
          "doc_type": "technical_architecture",
          "scope": "project"
        }
      ]
    },
    {
      "step_id": "per_work_package",
      "iterate_over": {
        "doc_type": "work_package",
        "collection_field": "work_packages",
        "entity_type": "work_package"
      },
      "scope": "work_package",
      "execution_mode": "manual",
      "steps": [
        {
          "step_id": "work_statement_decomposition",
          "role": "Project Manager 1.0",
          "task_prompt": "Work Statement v1.0",
          "produces": "work_statement",
          "scope": "work_package",
          "inputs": [
            {
              "entity_type": "work_package",
              "scope": "work_package",
              "context": true
            },
            {
              "doc_type": "technical_architecture",
              "scope": "project"
            }
          ]
        }
      ]
    }
  ]
}
